{
  "identified": 3,
  "deduplicated": 0,
  "screened": 1,
  "excluded_title_abs": 1,
  "fulltext_assessed": 1,
  "fulltext_excluded": {
    "title/abstract not relevant to optical isac": 1,
    "non-optical; no opa or ris": 1
  },
  "included_qual": 1,
  "included_quant": 0,
  "last_updated": "2025-10-01T20:06:17.297039Z"
}